同程艺龙升逾4%，惟上半年少赚54.39%,Contrast
泡泡玛特2019年营收16.3亿，同比增227%,Supplement
中奥到家飙近8%，折让16%发新股予绿城服务,Parataxis
晶苑国际现飙5%，一度涨近15%,Degree
远东发展5月12日回购21万股，耗资59万港币,Causality
恒基地产目标价下调至50.5港元，维持买入评级,Parataxis
航空股集体反弹，中国国航涨5.37%,Phenomenon-Instance
华彩控股连升三日，突破100天线,Parataxis
港股恒指涨0.66%，返24000,Supplement
澳洲成峰高教5月11日回购76万股，耗资21万港币,Causality
晋商银行逆市干升近半成，获中央汇金增持逾1亿股,Causality
大跌市公用股无一幸免，港华煤气跌近6%,Phenomenon-Instance
康希诺生物现涨逾半成，创上市新高,Parataxis
欢聚时代7亿砸向虎牙直播，或将年亏4亿,Inference
冠均国际跌近60%，创52周新低,Supplement
人保集团目标价上调至4.1港元，维持买入评级,Parataxis
网龙绩后获利，跌近7%,Degree
合生创展豪掷180亿，拿下北京豪宅地块,Parataxis
彩生活及中海物业上升2%，惟雅生活微跌,Contrast
港股暴涨3.9%，莎莎国际暴涨17%,Phenomenon-Instance
港股今日急跌逾千点，难预指数走向,Parataxis
三大原因造成医药股杀跌，医疗器械集采也来了,Other
精熙国际5月26日回购10万股，耗资5万港币,Causality
中国人寿逆市靠稳，首8个月原保险保费收入升近6%,Parataxis
恒指跌0.39%，金山软件跌7%,Phenomenon-Instance
港股恒指低开0.6%，吉利汽车跌近2%,Phenomenon-Instance
中国奥园跌6.55%，此前公告拟收购百年人寿13.86%股权,Inference
比亚迪营收超1300亿，同增22.79%,Supplement
全球供应趋紧，白糖或步入上涨新周期,Inference
国泰君安国际5月5日回购22万股，耗资21万港币,Causality
微贷网二季度净收入为9.067亿元，环比下降4.5%,Supplement
洛阳钼业跌逾3%，跌穿50天线,Supplement
数码通电讯降至沽售评级，下调目标价至4.3港元,Parataxis
澳洲成峰高教6月3日回购20万股，耗资5万港币,Causality
丽新系个别干升，丽丰控股上扬19%,Phenomenon-Instance
港股科技巨头回调，小米美团跌逾6%,Phenomenon-Instance
瑞声科技升幅扩大至13%，重返45元水平,Parataxis
北向资金净流入48.65亿元，深股通流入35.47亿,Phenomenon-Instance
小牛电动第一季度净利润为1460万，同比扭亏为盈,Supplement
畅游一季度营收1.23亿美元，同比下降10%,Supplement
阿里巴巴第二财季净利达327.5亿元，同比增长40%,Supplement
海底捞涨近3%，获MSCI纳入中国指数,Causality
港股走势料继续受压，或需再下试25600点,Inference
港股恒指跌0.08%，中国生物制药跌4.38%,Phenomenon-Instance
发电量、售电量双降，华能国际前3季净利却大增1.7倍,Contrast
北向资金净流出7.44亿元，沪股通净流入2.36亿,Phenomenon-Instance
特步国际目标价为3.12港元，降至收集评级,Parataxis
李宁升逾5%，创逾三个月高位,Supplement
港股恒指大涨1.28%，重返24000点,Supplement
李宁上扬近2%，累涨逾15%,Degree
维持瑞声科技买入评级，上调目标价至56港元,Parataxis
尽管与伦交所的收购失败，从不后悔曾经出发,Contrast
百奥家庭互动6月2日回购70万股，耗资60万港币,Causality
手机设备股造好，鸿腾精密上升16%,Phenomenon-Instance
中国天保集团跌逾8%，创上市新低,Supplement
五菱汽车升逾59%，创52周新高,Supplement
恒指跌0.19%，周黑鸭大涨10%,Phenomenon-Instance
华为概念股集体大跌，瑞声跌5.37%,Phenomenon-Instance
富时罗素“加仓”两倍，84股成“新宠”,Other
中国环能升近71%，创1个月新高,Supplement
阿里健康跌超7%，此前公布年度亏损幅度收窄82.9%,Parataxis
内银续回落，建行下跌2%,Phenomenon-Instance
港股午后跌幅扩大，下跌302点,Degree
科技股拖累，纳指收跌,Causality
内地教育股逆市上扬，新高教集团涨7%,Phenomenon-Instance
中国铁塔挫逾2%，遭高盛下调目标价,Causality
石药集团升逾3%，主动买盘57%,Parataxis
友邦保险升近1%，破百天线,Supplement
九龙仓集团续升近2%，获大和重申买入评级,Causality
凌锐控股突然有资金追捧，急升32.43%,Causality
康宁医院医疗业务毛利降至22.3%，公司股价大跌17%,Causality
金沙中国现价跌近1%，惟中期多赚9%,Contrast
美团点评绩后升幅扩至近9%，市值一度突破8千亿元,Parataxis
香港中华煤气暂连升六日，累涨超过4%,Degree
利福国际跌至逾三年低，现反弹近4%,Contrast
瑞声科技获资金流入，暴涨12%,Causality
华电福新获华电集团溢价65.56%，提私有化要约,Causality
出口股普涨，敏华控股抽升逾7%,Phenomenon-Instance
中信建投证券随市抽升逾7%，创15个月高位,Supplement
康希诺生物现飙逾4%，暂录九连升,Parataxis
绿城服务逆市飙升逾7%，破多条主要平均线,Supplement
融创中国跌近3%，5月LPR报价与上月持平,Parataxis
华兴资本午后收涨，被纳入MSCI中国小型股指数,Parataxis
港铁公司跌近3%，报39.65港元,Supplement
绿景中国地产升逾10%，暂连升2日,Parataxis
出口股个别发展，创科实业随市升逾2%,Phenomenon-Instance
港铁累跌近8%，现反弹逾3%,Contrast
趣店第三季度净利润达10.618亿元，同比增长52.9%,Supplement
美团大涨逾2%，最新市值为1132亿美元,Parataxis
广汽集团维持买入评级，下调目标价至9.8港元,Parataxis
广东榕泰涉嫌信披违规被立案，投资者索赔预登记启动,Other
大唐新能源今日暴涨37%，市值净增20亿,Parataxis
冒牌基金经理再现，基金投教工作有效性待提高,Other
港股恒指高开1.07%，信和置业涨2.63%,Phenomenon-Instance
中国联塑急涨逾7%，获建银国际升目标超过一成半,Causality
中煤能源未来30天股价将升，予与大市同步评级,Inference
日清食品再走高近3%，获联昌国际首予增持评级,Causality
光荣控股上升15%，创上市新高,Supplement
三桶油齐造好，开升1%至2%,Degree
中资银行股集体走高，近4个月内资大力扫货银行股,Parataxis
海底捞上升4%，获麦格理升至跑赢大市评级,Causality
油价急跌，航空股终反弹,Contrast
港股恒指低开1.52%，香港本地股集体下跌,Phenomenon-Instance
新数网络撤单，科创板“弃考生”增至6名,Causality
中集车辆登陆港股后又冲击A股，拟在深交所创业板上市,Inference
港股恒指低开2.15%，失守24000点,Supplement
映客5月4日回购44万股，耗资46万港币,Causality
恒基地产升逾3%，暂连升2日,Parataxis
首都金融跌近31%，创1个月新高,Supplement
耐世特反弹，升逾3%,Degree
远东发展5月6日回购21万股，耗资58万港币,Causality
港交所昨跌3%，拟就收购伦交所提高现金比例,Inference
10月份险企被罚超2400万元，财险公司罚款总额超五成,Supplement
雅迪控股升逾4%，创上市新高,Supplement
金科股份通过调用子公司富余资金议案，融创投反对票,Contrast
网信逾期规模或接近百亿，“先锋系”进入多事之秋,Other
瑞声科技跌逾3%，主动卖盘53%,Parataxis
领展续升逾2%，本周已回购逾411万股,Parataxis
网易启动港股招股，募资215亿港元,Parataxis
涪陵榨菜前三季度实现净利润5.18亿，同比微降0.99%,Supplement
一季度亏损17亿，美团餐饮外卖业务佣金收入下降13.7%,Parataxis
同程艺龙跌逾2%，失10天线,Supplement
获标普BB评级确认，旭辉合作扩张烙印,Causality
华泰证券再升近3%，中期多赚28%,Parataxis
中烟香港逆市飙近8%，暂三连涨,Parataxis
孙宏斌继续减持金科股份，两次累计回笼资金68亿元,Degree
舜宇光学上涨，累涨2.1%,Degree
港股恒指跌0.55%，海底捞微跌0.73%,Phenomenon-Instance
香港交易所暂升逾1%，主动买盘62%,Parataxis
香港零售股上升，思捷环球现升6.61%,Phenomenon-Instance
恒瑞医药单季营收55亿，孙飘扬身价追平李嘉诚,Parataxis
中汽新零售升近22%，暂连升2日,Parataxis
华润医疗跌逾4%，遭花旗降评级至中性,Causality
长和系股东会限制出席人数，可网上直播观看股东大会,Parataxis
中升控股升近3%，发行45.6亿元换股债,Parataxis
利丰今日举行股东会表决私有化议案，现价升近2%,Causality
小米再添猛将，原暴风TV，CEO刘耀平任小米电视总经理,Parataxis
美团点评微升逾1%，惟遭多间大行出货,Contrast
体育用品股下跌，李宁下跌2%,Phenomenon-Instance
港股科网股集体大跌，瑞声跌近6%,Phenomenon-Instance
雷军持股25.7%，小米拟巨额回购,Inference
雅迪控股升近11%，创上市新高,Supplement
希望教育升近5%，创上市新高,Supplement
网龙扬近4%，中标福州智慧校园建设项目,Causality
中联重科现升2%，第三季净利倍增,Parataxis
华润啤酒弹逾2%，破10天线,Supplement
瑞声逆市走低2%，再创四年新低,Supplement
万洲国际续涨近3%，暂表现最好蓝筹,Parataxis
碧桂园下跌超4%，领跌蓝筹,Parataxis
优步业务有所回暖，但仍同比下降70%,Contrast
大和维持对内险行业保守看法，推荐友邦及中国财险,Parataxis
中海油升近2%，日前获星展上调目标价,Parataxis
碧桂园拟5亿元入股瓷砖生产商蒙娜丽莎，持股5%以上,Inference
21世纪教育5月18日回购126万股，耗资80万港币,Causality
四海国际升逾13%，创1个月新高,Supplement
微盟集团飙逾6%，续获北水持仓急增至逾17%,Causality
高伟电子抽高逾6%，明日除净,Parataxis
美国页岩油主产区一年来首跌，拖累全美原油产量,Causality
五菱汽车升近30%，暂连升3日,Degree
港股公司纷纷盯上科创板各显回A神通，估值或为主因,Inference
港股恒指跌1.3%，石油股全线走低,Phenomenon-Instance
中国联通涨4.23%，领涨蓝筹,Parataxis
舜宇光学连日获北水追捧，现涨2%,Causality
房托股亦难逃大跌市，领展下跌10%,Phenomenon-Instance
瑞声科技升近3%，主动买盘62%,Parataxis
美团点评上半年亏损287.81亿元，同比扩大131.42%,Supplement
特步国际挫逾16%，现反弹近4%,Contrast
奥栢中国闪崩暴跌近60%，此前8个交易日股价暴涨380%,Parataxis
华兴资本跌近4%，创上市新低,Supplement
和谐汽车扬近3%，收购两间中国宝马网点,Parataxis
友邦保险下跌1%，惟获大摩升目标价,Contrast
东风集团逆市升近3%，武汉考虑扶持东风汽车,Causality
蘑菇街第三财季净利润超1370万元，同比扭亏,Supplement
迅雷第二季度净亏损70万美元，环比大幅收窄,Supplement
金鹰商贸集团5月5日回购0.4万股，耗资2万港币,Causality
5G股再走高，长飞光纤上扬2%,Phenomenon-Instance
居住业数字化水平提升，多品牌协作将成可能,Inference
蘑菇街第四财季营收2.176亿元，同比增长15.9%,Supplement
外围风险升级，稀土概念炒高,Causality
海底捞六连扬，累升23.7%,Degree
领展升逾1%，破顶,Supplement
巨星医疗控股5月12日回购2万股，耗资3万港币,Causality
李嘉诚5月四度增持长实，今年累计耗资逾11亿,Parataxis
海螺水泥跌近2%，暂为跌幅最小国指股,Parataxis
宏达新材显示拍卖结果，或影响全年业绩,Inference
禹洲地产财务恶化遭降级，冲刺千亿路坎坷,Causality
卓信国际逆市涨逾25%，惟料季度盈转亏,Contrast
港股恒指微涨0.01%，美团点评涨5%,Phenomenon-Instance
维信金科6月2日回购10万股，耗资40万港币,Causality
百富环球5月27日回购88万股，耗资278万港币,Causality
阿里健康目标价升50%至30港元，维持买入评级,Parataxis
长实跌近3%，报48.45港元,Supplement
日本消费税十一上调至10%，游戏及会员服务将应声涨价,Inference
科劲国际下跌3%，创近52周新低,Supplement
万洲国际跌3%，领跌蓝筹,Parataxis
大新金融连跌四日，累挫逾半成,Degree
内房股集体飙升，宝龙地产涨7.19%,Phenomenon-Instance
香港地产股全线向上，恒隆地产涨近2%,Phenomenon-Instance
九龙仓置业续跌近1%，主动买盘70%,Parataxis
吉利汽车前7月总销量为74.3万辆，同比下降16%,Supplement
恒安国际跌累挫逾12%，创逾两年新低,Supplement
百威亚太跌近2%，首季盈转亏损600万美元,Parataxis
大摩上调阿里健康目标价至21.4港元，维持增持评级,Parataxis
三桶油见反弹，中石油升逾2%,Phenomenon-Instance
花旗维持平安好医生目标价92.8港元，给予买入评级,Parataxis
福晟国际股价10日暴跌62%，今日暴涨86%,Contrast
南方能源半日下跌15%，现倒升逾18%,Contrast
金山软件逆市上涨，逾近4%,Degree
波音8月交付量下降72%，737MAX机型停飞所致,Causality
TEAMWAY上日急涨近三成，今日下跌11.34%,Contrast
李嘉诚卷土重来，5月四度增持长实,Parataxis
恒安国际跌逾5%，报67.35港元,Parataxis
友邦首季新业务价值按年跌27%，现涨近1%,Contrast
区块链概念高位回落，金山软件跌逾6%,Phenomenon-Instance
中粮包装5月7日回购490万股，耗资1435万港币,Causality
中粮包装5月19日回购42万股，耗资126万港币,Causality
网易超购27.4倍，将触发12%回拨机制,Inference
新奥能源上升，暂领涨国指股,Parataxis
港股维亮控股午后闪崩，跌近80%,Degree
星亚控股现跌近13%，接获清盘呈请,Causality
舜宇光学升逾3%，主动买盘66%,Parataxis
易大宗5月27日回购49万股，耗资8万港币,Causality
港股恒指跌0.73%，香港地产股上涨,Contrast
腾讯控股第四季度净利润为142.29亿元，同比下滑32%,Supplement
中烟香港三日重挫20%，净利下滑30%,Parataxis
颐海国际微升1%，创上市新高,Supplement
融创集团间接清仓乐视网股份，深交所关注四方面事项,Parataxis
小赢科技第三季度净营收8.295亿元，同比增长83%,Supplement
航空股续涨，东航扬逾1%,Phenomenon-Instance
1药网母公司111集团第四季度净亏1.096亿元，同比增亏,Supplement
中粮包装5月21日回购83万股，耗资244万港币,Causality
世茂升近2%，创上市新高,Supplement
中信股份升逾1%，中期多赚9%,Parataxis
中国恒大前4月销售2126亿，刷新历史记录,Supplement
小米集团-W重申买入评级，升目标价至15.6港元,Parataxis
阿里140亿迎娶考拉，能否改变中国10万亿跨境电商市场,Inference
SOHO中国昨日暴跌26%，传黑石暂停洽谈私有化,Inference
中国太保目标价下调至35港元，维持买入评级,Parataxis
中烟香港三连跌，现反弹近7%,Contrast
市场气氛火爆，恒指三万点可期,Inference
友邦首季新业务价值按年跌27%，逊预期,Supplement
李宁逆市涨逾2%，李宁获调任联席行政总裁,Causality
房企5月销售继续走高，恒大单月超600亿,Phenomenon-Instance
微创医疗升逾4%，创上市新高,Parataxis
中航科工6月2日回购17万股，耗资62万港币,Causality
北向资金净流入51.07亿，沪股通净流入10.81亿,Phenomenon-Instance
金山软件第二季度总收益为18.74亿元，同比增长39%,Supplement
旷视科技上市地成迷，场景落地或存“隐患”,Inference
美股大跌，英特尔、高通、博通、英伟达等芯片股均有下滑,Phenomenon-Instance
迅雷股价翻倍，但发展区块链并不是炒币,Contrast
区块链概念持续大涨，易见股份等15股涨停,Phenomenon-Instance
港交所业绩现结构性改变，恒指料点24000争持,Inference
创维集团升逾10%，报2.06港元,Supplement
中国移动逆市涨近2%，为目前最佳蓝筹,Parataxis
万科企业反弹近2%，获摩通列为首选股,Causality
腾讯与环球音乐母公司商谈，或将收购环球音乐10%股权,Inference
瑞银维持中国外运买入评级，降目标价至2.9港元,Parataxis
联想控股跌幅扩大至逾2%，拟发最多30亿人民币定息债,Inference
现代牧业飙升9%，中期扭亏赚逾1亿元,Supplement
港交股价大涨逾4%，创2018年1月来新高,Supplement
阅文集团上半年调整后净利润为3.9亿，同比下降19.3%,Supplement
领展房产基金目标价降至84港元，维持买入评级,Parataxis
泛海3月至今耗资6亿元，折价约17%,Supplement
中联重科涨逾半成，月内累升超过21%,Degree
比亚迪电子大跌逾6%，遭建银国际下调目标价及评级,Causality
网易港股上市引爆打新潮，认购倍数或超90倍,Inference
零售股急涨，周大福上升9.59%,Phenomenon-Instance
港铁公司跌逾3%，创52周新低,Supplement
中手游今日挂牌0.71%，破发,Supplement
金山软件涨逾3%，首季亏转盈,Parataxis
保险股大涨，兴证具备长期配置价值,Other
兖州煤业5月22日回购200万股，耗资1216万港币,Causality
瑞银下调百威亚太目标价至22.64港元，给予中性评级,Causality
生物科技股逆市造好，基石药业涨逾7%,Phenomenon-Instance
港股恒指跌幅扩大至1%，阿里概念股跌幅居前,Phenomenon-Instance
港铁公司跌1%，自7月高点市值蒸发500亿,Parataxis
兴达国际10月31日回购9.6万股，涉资20.64万港元,Supplement
渣打收复50天线，创逾月内新高,Parataxis
小米再引入新高管，任命杨柘出任中国区CMO,Parataxis
港股恒指低开2.15%，B类股继续大跌,Phenomenon-Instance
中航国际飙逾11%，惟长和上周三减持,Contrast
中海油跌逾3%，报8.47港元,Supplement
绿城服务暂三连升，累涨17%,Degree
网易今天开启簿记，下周四挂牌,Parataxis
利标品牌上升38%，破50天线,Supplement
西部水泥跌逾7%，惟中期多赚23%,Contrast
中国智能健康6月1日回购80万股，耗资2万港币,Causality
小米集团扬近4%，回购最多120亿元股份,Parataxis
博雅互动不派息，研究开发新的竞技赛事,Parataxis
阿里巴巴维持跑赢大市评级，目标价274元不变,Parataxis
龙湖集团跌逾5%，创1个月新低,Supplement
澳优升逾8%，创上市新高,Supplement
中国金茂升近5%，报5.62港元,Supplement
中信股份升逾1%，破10天线,Supplement
联康生物科技集团5月8日回购124万股，耗资19万港币,Causality
花旗维持申洲国际买入评级，上调目标价至108港元,Parataxis
单月销量及环比9家上升，10家下降,Contrast
服装股逆市受捧，思捷环球飙升13%,Phenomenon-Instance
港股恒指跌0.71%，内地医药股反弹,Contrast
中国智能健康5月20日回购275万股，耗资8万港币,Causality
稀土概念炒高，中国稀土涨11%,Phenomenon-Instance
3月澳门博彩收入同比减少0.4%，优于市场预期,Supplement
阿里有望纳入恒指，但二次上市公司预计短期不会进入港股通,Contrast
保险股连日受捧，友邦及中国财险各扬4%,Phenomenon-Instance
银河娱乐升近3%，创1个月新高,Supplement
生科股午后集体倒跌，康希诺下跌10%,Phenomenon-Instance
长江基建及电能齐跌近4%，暂为跌幅最大蓝筹股首二位,Parataxis
融创高点精准减持金科，再套现逾21亿,Parataxis
金鹰商贸集团5月22日回购49万股，耗资371万港币,Causality
汇创控股现急跌31.43%，为跌幅最大股份,Supplement
亚洲水泥现跌2%，惟料首三季利润按年最多升四成,Contrast
石药集团午后倒升近4%，暂冠蓝筹,Parataxis
爱康医疗昨日飙升，逾近17%,Degree
安踏体育再涨逾2%，企稳70元,Parataxis
北向资金净流入17.5亿元，恒瑞医药净买入4.68亿元,Phenomenon-Instance
天誉置业5月4日回购165万股，耗资166万港币,Causality
花旗维持阿里巴巴买入评级，目标价上调至299港元,Parataxis
内港软件股炒起，金蝶国际急涨升5.43%,Phenomenon-Instance
汽车之家第四季度净利润为1.192亿美元，同比增长74%,Supplement
克莉丝汀无升跌，报0.6港元,Parataxis
新股获544倍认购，中手游或成港股年度“冻资王”,Inference
港股恒指下跌3%，石油股暴涨,Contrast
港股短期料下试24900点，盼炒储局减息预期,Inference
思考乐教育逆市飙近6%，惟上半年少赚9%,Contrast
药股回落，中生制药下跌3%,Phenomenon-Instance
日清食品跌逾8%，首季纯利升7.95%,Contrast
周四黄金期货收跌1.7%，白银期货大跌3.7%,Phenomenon-Instance
李宁获大华继显升评级及目标价，惟逆市跌逾2%,Contrast
何猷龙连续6日增持新濠国际股份，最新持股增至57.44%,Parataxis
中交建反弹逾2%，获大和升至买入评级,Causality
神州租车午后升幅扩大至21%，暂连升4日,Parataxis
特步涨近6%，破50天及100天线,Supplement
奥柏中国曾创年半新高，现倒跌近36%,Contrast
中国交通建设5月29日回购200万股，耗资979万港币,Causality
超威动力一度跌超10%，同业天能动力遭沽空机构狙击停牌,Causality
百世物流第二季度营收为87.88亿元，同比增长30.5%,Supplement
航空股普遍走低，中国国航及东航各跌3%,Phenomenon-Instance
天喔国际正考虑港交所摘牌决定，或于5月25日退市,Inference
福森药业5月19日回购79万股，耗资267万港币,Causality
太古A跌逾2%，创52周新低,Supplement
疫情影响核心业务，美团点评第一季度亏损17亿,Causality
民银资本5月22日回购39万股，耗资5万港币,Causality
美团点评目标价升至143港元，重申买入评级,Parataxis
吉利涨近5%，领涨蓝筹,Parataxis
美团一季度亏了17亿，却有这个意外,Contrast
国信香港又一员工遭禁业，前有洗黑钱23亿被港证监彻查,Parataxis
违规收集个人信息，暴风金融等网贷APP遭监管点名,Other
华润燃气累跌7%，现反弹半成,Contrast
贵金属反弹，中国白银集团逆市飙升12.17%,Phenomenon-Instance
国寿集团增持600万股农业银行H股，触发二次举牌,Causality
沪指高开低走跌0.14%，纳指逼近历史纪录收盘点位,Other
中骏集团上海公司总经理林峻岭提出离职，助理总裁彭飞接管,Parataxis
中国星集团6月1日回购148万股，耗资259万港币,Causality
中概股收盘多数下跌，瑞幸复牌次日再度暴跌近30%,Phenomenon-Instance
寺库网第一季度净营收8.03亿元，同比增长42.8%,Supplement
中国神华涨逾2%，暂冠蓝筹,Parataxis
金沙中国上升5%，报30.45港元,Supplement
港股同仁堂国药涨超12%，获两位董事共增持3.8万股,Causality
恒指高开低走涨0.69%，三桶油大涨,Phenomenon-Instance
港股恒指跌0.27%，联想控股涨13%,Contrast
四海国际升逾11%，主动买盘35%,Parataxis
安东油服创近两年新低，现反弹逾4%,Contrast
平安好医生连跌4日，现反弹逾4%,Contrast
物管股低位有承接，佳兆业美好上涨3%,Causality
再战港股，中邦园林拟IPO募资救急,Inference
海纳智能拟发行1.16亿股，预期6月3日上市,Inference
香港特区限聚令放宽，中环酒吧重开满座,Causality
阅文新管理层回应旧合同争议，新举措破除行业沉疴,Parataxis
长江基建跌逾3%，报43.9港元,Supplement
全球银行业今年已宣布裁员近5万人，欧洲最为显著,Other
体育用品股集体上涨，安踏体育涨4%,Phenomenon-Instance
药股回落，石药集团下跌4%,Phenomenon-Instance
泡泡玛特港交所IPO，布局57城825家商店,Parataxis
房天下第一季度净亏损1050万美元，同比大幅减亏,Supplement
港股科网股集体大跌，中兴通讯大跌9.13%,Phenomenon-Instance
阿里健康股价大跌5%，2020财年营收增速或降至两位数,Inference
中芯国际升近6%，报17.8港元,Supplement
友邦保险目标价降至91港元，维持增持评级,Parataxis
香港银行股普遍受压，渣打集团下跌1.26%,Phenomenon-Instance
航空股大跌，中国东方航空跌4%,Phenomenon-Instance
中国恒大净利腰斩，股价大跌近6%,Causality
恒指金融股权重维持不设限，友邦上涨2%,Phenomenon-Instance
股价偏软近1%，失守100天线,Supplement
亿万富翁称股市可能会缩水一半，黄金即将飙升,Inference
永达汽车现跌近6%，跌穿10天及20天百天线,Supplement
燃气股逆市走高，北燃蓝天飙逾8%,Phenomenon-Instance
阿里大文娱第四财季营收56.71亿元，同比增长8%,Supplement
中航科工5月28日回购13万股，耗资45万港币,Causality
午后猪肉概念股异动拉升，新希望大涨超8%,Phenomenon-Instance
比亚迪电子涨逾2%，长沙厂房首批华为手机下线,Other
恒指转跌0.26%，本地地产股大跌,Phenomenon-Instance
港股三大指数翻红，消费股集体走高,Causality
创科实业现跌近2%，曾跌穿10天线,Parataxis
陌陌2019年第一季度营收37.23亿元，同比增长35%,Supplement
小摩维持华润燃气增持评级，目标价为47.7港元,Parataxis
龙辉国际突然有资金追捧，暂表现最佳个股,Parataxis
小米集团斥资1亿美元增持紫米，持股比例将达49.91%,Inference
腾讯视频订购账户数达9690万，同比增长30%,Supplement
舜宇光学升近5%，主动买盘58%,Parataxis
中国生物制药PD-1上市申请获受理，与3公司存竞争关系,Parataxis
花旗净沽出建行及工行，惟现价仍跌近0.5%,Contrast
内银绩后普遍向好，中行微升0.31%,Phenomenon-Instance
蚬壳电业公开发售，获认购37.30倍,Parataxis
