强势股续回调，港股或试22300点,Inference
沛嘉医疗开启招股，中签率达17%,Supplement
堡狮龙升逾20%，创52周新高,Supplement
恒指涨0.1%，康希诺跌14%,Contrast
雅生活服务上涨4%，花旗上升目标价至53.8港元,Causality
港股恒指小幅高开0.18%，航空股上涨,Phenomenon-Instance
瑞声绩后受压，港股午后变动不大,Causality
小摩增持保利物业，涉资逾1亿港元,Supplement
港股恒指午后走高，涨0.89%,Degree
美团点评一季度调整后亏损2.2亿元，营收下滑12.6%,Supplement
中欧远见逆市加仓港股，瞄准美团,Other
中国星集团5月21日回购200万股，耗资350万港币,Causality
中国财险给予买入评级，目标价为9.09港币,Parataxis
荣盛发展拟拆分旗荣万家港股上市，公司持股91.2%,Inference
部分汽车股反弹，华晨中国上涨1%,Phenomenon-Instance
服装股逆市受捧，佐丹奴上扬5%,Phenomenon-Instance
中生制药升逾3%，主动买盘70%,Parataxis
香港地产收租股全面下跌，九龙仓置业及太地均跌逾2%,Phenomenon-Instance
港交所再现人事变动，上市科IPO审查联席主管史琳请辞,Supplement
中国飞鹤今起招股，预期11月13日上市,Inference
华兴资本控股5月12日回购2万股，耗资26万港币,Causality
在线医疗股逆市获追捧，平安好医生涨逾2%,Causality
碧桂园发行5.44亿美元票据，利率为5.40%,Supplement
平安好医生暂两连扬，累升8%,Degree
宜人金科第三季度营收20.561亿元，同比扭亏为盈,Supplement
公路股受追捧，越秀交通扬逾2%,Phenomenon-Instance
小米逆市升逾1%，暂连升7日,Parataxis
万科企业开涨逾3%，折让4.76%配股,Parataxis
中生制药日内放榜，现跌逾3%,Parataxis
新奥能源反弹3%，暂表现最佳国指股,Parataxis
国际油价回升，航空股下跌,Causality
敏华控股业绩逐步恢复，予“买入-A”评级,Causality
百威亚太累跌近12%，反弹2%,Contrast
逾30家A股房企已公布半年报，业绩总体表现超预期,Supplement
复星国际扬逾5%，半年纯利升11%,Parataxis
海底捞涨近4%，再创上市新高,Supplement
蔚来汽车一季度交付3989辆ES8，超出原定预期,Supplement
日清食品现反弹近4%，昨急跌近9%,Contrast
华彩控股突有资金追捧，现逆市急升54.21%,Causality
易易壹金融获提私有化，今早复牌,Causality
舜宇光学升逾3%，报109.8港元,Supplement
广州基金下跌16%，创上市新低,Supplement
民银资本5月6日回购56万股，耗资6万港币,Causality
手游股急涨，中手游反弹15%,Phenomenon-Instance
现代牧业升近11%，创1个月新高,Supplement
消费股集体走低，正通汽车跌8.5%,Phenomenon-Instance
领展跌近3%，报58.65港元,Supplement
电动汽车销量超过燃油车，挪威创全球首例,Phenomenon-Instance
美股现反弹，港股短线支持于22400点,Parataxis
港股恒指午后跌0.86%，香港本地地产股大跌,Phenomenon-Instance
小摩下调汇丰控股目标价至38.5港元，保持中性评级,Parataxis
英皇证券市场憧憬经济复苏，恒指波动酝酿吸纳良机,Other
碧桂园龙头地位稳固，维持买入评级,Parataxis
中教控股收购肇庆地皮，建大学校园,Parataxis
简普科技第一季度营收6.55亿元，同比增长95%,Supplement
港股恒指走高涨0.34%，医药股集体爆发,Phenomenon-Instance
中远海控完成发行10亿人民币中期票据，利率为2.5%,Supplement
新创建涨近3%，出售旗下新渡轮六成股权予珠江船务,Parataxis
德昌电机目标价降36%至12.7元，下调至中性评级,Parataxis
药明生物控股股东开年来第3次减持，套现近70亿元,Parataxis
保利协鑫升近11%，创1个月新高,Parataxis
思考乐教育逆市上升，创下历史新高,Parataxis
美股现回调压力，B类股炒作须留意,Other
二线物管股炒起，佳兆业美好涨6%,Phenomenon-Instance
中生制药逆市升逾1%，创一年新高,Supplement
中烟香港获纳入港股通，股份跌逾6%,Contrast
港股恒指低开0.37%，中国石油跌1.3%,Phenomenon-Instance
部分纸业股逆市造好，玖纸涨逾7%,Phenomenon-Instance
常达控股升逾20%，主动买盘64%,Parataxis
医疗设备股大涨，微创医疗涨10%,Phenomenon-Instance
万达商管一季度营收减半，王健林下命令不改目标,Contrast
网易将追加回购10亿美元股票，总规模达20亿美元,Supplement
通达集团涨近2%，获大华继显吁买入评级,Causality
小摩增持保利物业，最新持股为7.81%,Parataxis
料恒指走势反复，在26600水平争持,Other
港股走势在转弱，料进一步下试23300点,Inference
雅迪控股升逾2%，暂连升5日,Parataxis
出口股续跌，申洲国际跌幅扩大至逾4%,Phenomenon-Instance
高富集团控股上升50%，成交442.84万股,Parataxis
恒大斥资1.92亿港元，再回购1208万股股份,Parataxis
利丰小股东不支持私有化建议，称无体谅小股东,Parataxis
中国稀土跌近2%，成交约228万股,Parataxis
沪指涨近2%，北向资金大幅流入55亿,Parataxis
君实生物目标价升至45港元，维持跑赢大市评级,Parataxis
金鹰商贸集团5月19日回购60万股，耗资449万港币,Causality
高盛下调百威亚太目标价至25.9港元，给予买入评级,Parataxis
张朝阳致信畅游董事会，将重新评估私有化价格,Inference
港股恒指跌0.71%，吉利汽车跌9%,Phenomenon-Instance
汽车股普跌，吉利汽车下跌2%,Phenomenon-Instance
"""海上驼队""民企挑大梁，交通运输部将提减负政策建议",Inference
云米科技第四季度营收9.56亿元，同比增142.6%,Supplement
小米暂连升7日，累涨约20%,Degree
万洲国际旗下双汇获准重组合拼，惟股价跌近2%,Contrast
汽车股随市下跌，吉利汽车连跌3日,Phenomenon-Instance
恒大地产集团拟发行40亿元公司债券，票面利率为5.9%,Supplement
华为遭美国封杀升级，中芯跌6%,Causality
京东认购国美1亿美元可转债，转股可持2.8%股份,Parataxis
鲁大师再上飙，两日累涨约3倍,Degree
万洲国际走高近2%，暂三连升,Parataxis
净利是海底捞的11倍市值，却被反超,Contrast
建业新生活悉数行使超额配售权，涉及合共4500万股份,Supplement
摩根大通高位减持康希诺生物-B，套现约11.5亿港元,Parataxis
石药集团一季度股东溢利11.59亿元，同比增长21.8%,Supplement
碧桂园没有促销安排，但有信心,Contrast
华泰证券再升近3%，暂冠国指股,Parataxis
小米集团重上10天线，主动买盘61%,Parataxis
航空股全线下跌，南航跌近2%,Phenomenon-Instance
鲍威尔鸽派言论不敌贸易利空，美股遭遇恐慌性抛售,Causality
明年5G智能手机出货量将达1.235亿部，占近9%,Supplement
中国稀土一度涨超12%，上周五涨近20%,Parataxis
中信银行跌逾1%，跌穿十天线,Supplement
"中手游暗盘盘中涨近6%，有望问鼎年度港股IPO""冻资王""",Inference
阿里巴巴已回购912万股股票，总价约为13.3亿美元,Supplement
顺兴集团跌逾8%，创上市新低,Supplement
吉利汽车升幅扩至7%，富瑞预料下半年利润会改善,Inference
中国太平升近5%，主动买盘69%,Parataxis
腾讯音乐第四季度营收54亿元，同比由盈转亏,Supplement
索尼和迪士尼“分手”了，但“蜘蛛侠宇宙”才刚开启,Contrast
花旗上调美团点评目标价至145港元，维持买入评级,Parataxis
内需股继续受捧，华润啤酒上升3%,Phenomenon-Instance
耐世特飙近8%，破10天线,Supplement
ST沈机重整后持续经营能力仍受质疑，董事长等多位高管辞职,Causality
鑫苑狂涨，超100%,Degree
亚联发展筹划非公开发行股票，欲收购上海即富20%股权,Inference
美股期货急挫，拖累重磅股捱沽,Causality
华润啤酒下跌，现反弹近1%,Contrast
啤酒股造好，华润啤酒涨超6%,Phenomenon-Instance
高盛维持阿里巴巴买入评级，目标价达至280港元,Parataxis
港股预托证券表现平稳，预料大市温和高开,Inference
领展升幅扩大至近5%，全年可分派总额按年升4%,Parataxis
鲍威尔鸽派言论不敌贸易利空，美股遭遇恐慌性抛售,Causality
周黑鸭现跌逾3%，遭瑞信降目标价10%,Causality
中国龙工现跌近2%，遭高盛降目标价15%,Causality
香港中华煤气走高近2%，暂连升六日,Parataxis
新世界发展下跌，逾3%,Supplement
恒指跌1%，香港本地股大跌,Phenomenon-Instance
港交所涨逾2%，阿里拟最快下月来港上市,Inference
映客5月12日回购82万股，耗资81万港币,Causality
光伏股受捧，福莱特玻璃飙逾9%,Phenomenon-Instance
李嘉诚今年累计出手逾20次，耗资逾17亿,Supplement
瑞声科技升近3%，报40.6港元,Supplement
恒指大涨1.78%，香港本地股集体上涨,Phenomenon-Instance
香港建设5月5日回购0.2万股，耗资1万港币,Causality
港股汽车板块走低，比亚迪股份跌近9%,Phenomenon-Instance
中视金桥5月6日回购13万股，耗资12万港币,Causality
香港本地地产股扭转颓势，九仓涨6%,Phenomenon-Instance
地产收租股连续第二日跑输，新地软逾2%,Phenomenon-Instance
中生制药跌逾2%，暂连跌2日,Degree
京东股价盘前下跌，跌幅达1.07%,Degree
南方能源再度跳水，一度跌逾5%,Degree
21世纪教育5月20日回购102万股，耗资67万港币,Causality
小米手机海外销量反超华为，国内份额却在下滑是何布局,Contrast
华建集团上半年业绩双增，拟2亿控股景域园林,Inference
汇控飙升2%，重上10天及20天线,Supplement
华润燃气四连跌，现反弹半成,Contrast
美团点评目标价上调至153港元，维持买入评级,Parataxis
康臣药业5月11日回购45万股，耗资181万港币,Causality
瑞声科技逆市暴涨10%，领涨蓝筹,Parataxis
维亚生物跌近11%，主动卖盘62%,Parataxis
香港地产收租股受压，港股午后跌幅稍收窄,Causality
腾讯发威，市值重上4万亿港元,Parataxis
稀土股集体上涨，星宇控股涨8%,Phenomenon-Instance
中国恒大5月27日回购180万股，耗资3024万港币,Causality
稀土板块继续大涨，中国稀土开盘暴涨21.57%,Phenomenon-Instance
燃气股逆市上扬，华润燃气涨近3%,Phenomenon-Instance
中国移动营收净利十年来首双降，布局5G能否止跌？,Inference
海南前4月实际利用外资1.02亿美元，同比增长近20倍,Supplement
香港电视突破10天及50天线，主动买盘68%,Parataxis
内银股升幅扩大，晋商银行急涨逾13%,Phenomenon-Instance
苹果昨日急涨，超过3%,Degree
龙源电力维持中性评级，下调目标价至4.70港元,Parataxis
中国人寿重申买入评级，上调目标价至30港元,Parataxis
兴铭控股升近4%，创1个月新低,Supplement
荣盛发展拟分拆物业上市，物管公司赴港IPO热潮难退,Inference
北汽接盘，陆正耀将完全退出,Inference
大快活集团跌近5%，创三年半低位,Supplement
开拓药业-B超购约550.32倍，于5月22日上市,Parataxis
莎莎大跌，9月或降准金融股爆发,Inference
长江基建跌近3%，主动卖盘69%,Parataxis
市况表现良好，惟中国联通跌近2%,Contrast
MindtellTech大涨75%，此前获执董增持60万股,Causality
港股恒指跌0.13%，申洲国际跌近4%,Phenomenon-Instance
港股教育股跳水，天立教育、睿见教育大跌近20%,Phenomenon-Instance
港股恒指直线拉升0.66%，重返24000点大关,Supplement
昊海生物科技5月5日回购8万股，耗资327万港币,Causality
友邦保险涨近2%，惟大和降其目标价至95元,Contrast
中国金融投资管理6月3日回购100万股，耗资14万港币,Causality
美股大跌，这三只科技股却能在五月份继续牛下去,Contrast
任期内股价涨幅达960%，耐克CEO却突遭“下课”,Contrast
中环的超甲级写字楼又爆退租潮，麦格理弃近半楼面,Other
花旗维持5月赌收跌94%预期，金沙中国及美高梅各跌2%,Phenomenon-Instance
平安好医生连升2日，累涨18%,Degree
鹰普精密早上挫逾8%，现反弹近7%,Contrast
燃气股上升，中国天然气上涨4%,Phenomenon-Instance
网易第二季度净利润为36.45亿元，同比增长33.8%,Supplement
彩生活升逾9%，创1个月新高,Supplement
香港中华煤气上涨，累涨逾4%,Degree
港交易所5月日均成交额为1147亿港元，上涨18%,Supplement
神威药业飙近17%，上半年多赚12%,Parataxis
中国旺旺现获利盘，股份现跌逾2%,Contrast
港股成交缩减，或下试20天线,Inference
中软国际飙近10%，创近两个月新高,Supplement
梦洁股份2020年与薇娅合作4次，3次累计销售额为812万,Supplement
海底捞回应创始团队套现，股东在公益等方面有资金安排,Parataxis
吉利7月份销量同比减少约24%，将面临更大的挑战,Inference
沪指大跌1.89%，隔夜美股收低,Other
IMAXCHINA6月3日回购5万股，耗资64万港币,Causality
融创中国升逾5%，主动买盘67%,Parataxis
2019超8成车企净利下滑，22上市车企利润合计跌幅达23%,Other
网易被曝6月上旬在香港二次上市，盘中股价创历史新高,Parataxis
全通教育联姻吴晓波有四大硬伤，或成审核中的拦路虎,Inference
港股牛皮资金涌入公用股，中电控股下周一除净,Other
中国环境资源升近54%，创1个月新高,Supplement
金蝶国际涨近4%，上周获股东增持486万股,Causality
领展开涨近1%，获招商证券给予买入评级,Causality
希玛眼科升近10%，创52周新高,Supplement
环球实业升近56%，创1个月新高,Supplement
微软开盘涨逾2%，创历史新高,Supplement
港股恒指涨0.05%，广汽长城涨4%,Phenomenon-Instance
万洲国际涨近3%，暂四连升,Parataxis
公用股有资金追捧，煤气上涨1%,Phenomenon-Instance
F三星原油期升近4%，恢复增设基金单位,Causality
波司登再抽升至7%，惟各大行出货套现,Contrast
港股恒指涨0.4%，黄金股飙升,Phenomenon-Instance
建行中期多赚半成，惟逊预期,Supplement
公司平均ROE达到13.4%，高于港股平均,Supplement
同程艺龙大跌，跌幅超近4%,Degree
宝宝树上半年营收2.4亿元，同比下降40.9%,Supplement
通达集团涨近4%，破50天线,Supplement
日照港裕廊突飙45%，破10天及20天线,Supplement
中信股份升近5%，暂连升2日,Parataxis
友邦续涨近2%，重上100天线,Parataxis
国泰航空昨急升，今早回吐近3%,Contrast
春立医疗走高近6%，连续多日破顶,Parataxis
呷哺呷哺被列为被执行人，执行标的超22.7万,Parataxis
信利国际飙近10%，破50天及100天线,Supplement
港股恒指低开0.59%，中芯国际涨近4%,Phenomenon-Instance
21世纪教育6月3日回购180万股，耗资114万港币,Causality
碧桂园服务中期纯利升73.4%，绩后飙升9%,Parataxis
美团第一季营收168亿，亏17亿,Parataxis
中资航空股未止跌，中国国航跌逾2%,Phenomenon-Instance
海隆控股涨近13%，料上半年多赚9成,Inference
小米集团涨逾2%，印度工厂数日内复工,Other
长城汽车涨逾2%，创逾一个月高位,Supplement
周大福上升，升逾2%,Degree
中资电讯股全线下跌，中国电信现跌逾1%,Phenomenon-Instance
美团突破千亿美元，王兴身家突破百亿,Parataxis
港股倾向短期获利套现，料于23600点有支持,Inference
港股恒指低开0.89%，阿里巴巴跌2%,Phenomenon-Instance
宁德时代回应部分蔚来ES8召回，将配合蔚来召回工作,Inference
中铝国际完成发行10亿人民币短融券，利率为2.09%,Supplement
桥英控股上升20%，主动买盘100%,Parataxis
网易通过港交所聆讯，收入主要来自在线游戏服务,Parataxis
先健科技飙升近9%，工信部批复组国家制造业创新中心,Causality
国泰君安国际6月2日回购43万股，耗资41万港币,Causality
大摩上调新鸿基地产目标价至131港元，给予增持评级,Parataxis
新网银行利润超11亿，小米为二股东,Parataxis
赌股普遍下跌，金沙中国现下跌5.13%,Phenomenon-Instance
重庆钢铁跌逾8%，创52周新低,Supplement
汽车股在香港集体走高，广汽集团大涨5.4%,Phenomenon-Instance
药明生物与控股股东折让约8.11%售股，公司筹近40亿,Parataxis
内银股普涨，招商银行涨逾2%,Phenomenon-Instance
中国移动存在技术问题，稍后会重新上线,Parataxis
进阶发展升逾38%，创1个月新高,Supplement
港股午后跌幅扩大，现报27049点,Parataxis
水井坊前三季度净利润为6.39亿元，同比增38%,Supplement
万科企业拟配售3.16亿股新H股，净筹78.65亿港元,Inference
瑞声科技上半年净利同比下降57%，股价跳水跌4%,Causality
澳洲成峰高教5月5日回购43万股，耗资11万港币,Causality
生科股午后集体倒跌，康方生物下跌5%,Phenomenon-Instance
希望教育升逾5%，创上市新高,Supplement
A股三大股指翻红，创业板指涨幅扩大至1%,Phenomenon-Instance
友邦保险跌近3%，领跌蓝筹,Parataxis
敏华控股涨近6%，创逾一年新高,Supplement
港交所跌逾2%，失守牛熊线,Supplement
天福5月11日回购1万股，耗资5万港币,Causality
信德集团大涨22%，澳门博彩股走高,Other
腾讯升近1%，破20天线,Supplement
南旋控股涨近36%，料年度亏转盈,Inference
中兴通讯A、H股均涨近8%，此前公布中期净利增118.8%,Parataxis
碧桂园升近3%，暂连升5日,Parataxis
昔日对手变队友，京东1亿美元战略投资国美,Other
先施获伟禄集团溢价收购，股价急涨近13%,Causality
医疗制药股齐跌，微创医疗跌近8%,Phenomenon-Instance
物管股普遍向上，新城悦服务走高近4%,Phenomenon-Instance
香港本地地产股扭转颓势，长实涨5%,Phenomenon-Instance
日清食品倒跌逾3%，首季多赚近8%,Parataxis
猪肉概念股个别发展，万洲国际逆市下跌1%,Phenomenon-Instance
内房股受捧，奥园升约3%,Phenomenon-Instance
沙特新任能源部长承诺维持减产，美油涨逾2%,Causality
金界控股涨逾3%，创历史新高,Supplement
澳洲成峰高教5月29日回购16万股，耗资4万港币,Causality
国际油价创2个月高位，中海油上扬4%,Phenomenon-Instance
中国生物制药今日放榜跌近2%，暂结束八连升,Parataxis
中联重科目标价上调至6.49港元，维持买入评级,Parataxis
创科实业升逾2%，收复50天线,Parataxis
美团股价暴涨逾10%，与阿里大战一触即发,Parataxis
领展跌逾5%，创1个月新低,Supplement
百威亚太跌逾3%，三季度销量下滑,Parataxis
中航科工除息后抽高近4%，创逾2个半月高位,Supplement
腾讯周三公布季绩市场，手游收入增长加快,Parataxis
恒指跌幅扩大至1%，航空股大跌,Phenomenon-Instance
大摩重申美团点评增持评级，目标价上调至135港元,Parataxis
股价升逾2%，创7个月高,Supplement
翰森制药升逾2%，创上市新高,Supplement
阅文集团再跌5%，公司今年已累计回购近500万股,Parataxis
中国智能健康5月8日回购20万股，耗资0.58万港币,Causality
联想系公司上演上市潮，联想控股大涨7%,Parataxis
国美抱团京东拼多多，家电零售竞争“下半场”开幕,Other
康希诺生物-B目标价升至258港元，维持增持评级,Parataxis
A股家电板块炒起，海尔电器跟升近4%,Phenomenon-Instance
首长国际升逾23%，主动买盘71%,Parataxis
五洲国际就1.68亿财务贷款争议达成和解，股票继续停牌,Contrast
绿景中国地产升逾10%，创1个月新高,Supplement
联想集团第四季度净利大幅下滑64%，股价转跌,Parataxis
中金公司目标价为16.56港元，维持收集评级,Parataxis
宇华教育升近3%，创上市新高,Supplement
吉利汽车绩后升逾2%，惟中期盈利跌4成,Contrast
平安好医生深陷抄袭门，创业公司该如何跟大厂做生意?,Inference
高伟电子明日除净，派连特息共46.6616仙,Parataxis
生物科技股下跌，开拓药业急跌逾9%,Phenomenon-Instance
华润啤酒升逾4%，获执董增持10万股,Causality
恒指可能会重新计算估值，耐心等待大盘调整到位,Inference
港股大涨1.89%，阿里涨3%,Phenomenon-Instance
高通提供完整5G解决方案，推动5G终端落地,Causality
“瑞幸”危机促中概股回归，网易京东排队赴港二次上市,Causality
现货银高位回落，中国白银集团跌逾半成,Phenomenon-Instance
中国龙工跌穿10天及20天线，暂跌逾6%,Degree
中远海运港口升近6%，暂连升2日,Parataxis
安进斥资210亿港元，收购百济神州20.5%股权,Parataxis
港股续看25000点攻防战，濠赌股暂不考虑,Other
手机设备股领涨蓝筹，瑞声涨逾3%,Phenomenon-Instance
香港建设5月15日回购0.1万股，耗资0.549万港币,Causality
舜宇光学涨逾2%，华为首季出货量逆市增1%,Other
北向资金净流出33.26亿元，贵州茅台遭净卖出8.21亿元,Phenomenon-Instance
美银美林重申宇华教育买入评级，升目标价至8.6港元,Parataxis
奶品股受捧，中国飞鹤上涨7%,Phenomenon-Instance
中芯国际涨3%，一季度营收创新高,Parataxis
天能动力预期中期净利不少于30%，公司股价大涨12%,Parataxis
国策对药股支持，石药仅跌逾1%,Contrast
和信贷第四财季净营收410万美元，同比下滑85%,Supplement
中国燃气逆市急跌逾5%，股东SK集团出售约1.6亿股,Causality
保险股连日受捧，平保上涨3%,Phenomenon-Instance
中芯国际授出购股权予8位董事，合共235.97万份,Supplement
中海外跌近3%，主动卖盘64%,Parataxis
友邦反弹逾1%，中期多赚逾1倍,Parataxis
中资航空股未止跌，南方航空软近2%,Phenomenon-Instance
小米手机放弃性价比策略挽救净利润，但能挽救股价吗,Contrast
中金维持敏实集团跑赢大市评级，目标价为25.8港元,Parataxis
康方生物升逾4%，银屑病药完成首例患者给药,Supplement
远东发展5月20日回购47万股，耗资124万港币,Causality
佳兆业美好连跌两日，反弹,Contrast
华润燃气折让约7.14%，配股募资36.729亿元,Parataxis
华为首季出货量超预期，带动港股消费电子股,Causality
南方能源暴涨52.59%，2日累涨139%,Degree
市场忧虑未释除，港股预料25300至26000拉锯,Inference
北向资金大幅流入112.71亿元，为有史以来第4高,Supplement
中国铝业升近3%，获摩通上调评级及目标价,Causality
新濠国际五连跌，现反弹近2%,Contrast
内银股普遍上涨，交行扬近2%,Phenomenon-Instance
唯品会第一季度营收213亿元，同比增64.7%,Supplement
特斯拉概念股上扬，耐世特飙近7%,Phenomenon-Instance
广东概念股爆发，睿见教育涨15%,Phenomenon-Instance
港股恒指大涨1.11%，逼近24000点,Supplement
原三盛地产集团常务副总裁冯辉明履新上坤，出任执行总裁,Parataxis
日清食品急飙逾7%，创近2个月高位,Supplement
中国飞鹤开升3%，上日冠北水买入榜首,Causality
新东方在线急跌近7%，日前遭花旗吁卖出,Causality
港交所本周将跟券商会晤，讨论缩短IPO结算周期,Inference
手机设备股持续攀升，瑞声科技升近1%,Phenomenon-Instance
北向资金跑步进场，昨日流入92亿,Other
新意网扬逾5%，全年多赚超过11%,Parataxis
金鹰商贸集团5月4日回购0.5万股，耗资3万港币,Causality
比亚迪三季度业绩不及预期，H股急跌逾7%,Causality
世茂房地产开升2%，获纳入国指成分股,Causality
北京新发地疫情发酵，猫眼娱乐重挫9%,Causality
颐海国际升近4%，创上市新高,Supplement
新濠国际跌逾2%，暂停半年度股息计划,Causality
天福5月26日回购0.5万股，耗资2万港币,Causality
玩具制造商美泰公司盘前涨逾18%，Q3营收同比增长23%,Parataxis
港股今早借势反弹，26000点见明显阻力,Other
国艺娱乐跌逾20%，创上市新低,Supplement
九毛九收缩战线，将退出除华南和海南外其他市场,Inference
百奥家庭互动5月7日回购120万股，耗资100万港币,Causality
新能源车减少燃烧相关传感器，增加了电子系统传感器,Contrast
好未来第二财季净收入达6.998亿美元，同比增长53.5%,Supplement
香港地产股普遍下跌，太古地产现跌近1%,Phenomenon-Instance
途牛第二季度净营收为5.203亿元，同比下滑0.9%,Supplement
港股恒指涨0.98%，吉利汽车涨4.75%,Phenomenon-Instance
敏华控股目标价升至6.3港元，维持跑赢大市评级,Parataxis
中国燃气走高，涨逾3%,Degree
投行业给予跑赢大市评级，首选中信证券,Other
网易提交招股书，网易云用户超8亿,Parataxis
华为概念股集体大涨，瑞声科技涨4%,Phenomenon-Instance
大摩上调威高股份目标价至17港元，维持增持评级,Parataxis
内房股走软，中国海外发展跌近2%,Phenomenon-Instance
恒指涨0.48%，内险股大涨,Phenomenon-Instance
微盟集团升逾4%，创上市新高,Supplement
油价飙一成，中海油涨近9%,Phenomenon-Instance
港交所现上升1%，网易今起招股,Other
黑石收购洽谈案未定，SOHO中国暴跌后又反弹超13%,Causality
物管股有追捧，新城悦涨超过4%,Phenomenon-Instance
同仁堂升逾10%，报10.26港元,Supplement
诺发集团闪崩暴跌逾80%，市值仅剩3.5亿港元,Parataxis
中概股普跌，原油创两个半月新高,Phenomenon-Instance
